{
  "profileId": "SMProfile-CNCProgram",
  "version": "1.4.0",
  "standard": "CESMII",
  "displayName": "CNC Program (NC-Programm)",
  "description": "NC program executed by CNC machines and FFS cells — identified by O-number (e.g. O1001)",
  "parentType": null,
  "attributes": [
    {
      "name": "program_id",
      "dataType": "String",
      "category": "Core",
      "description": "O-number e.g. O1001",
      "polling": "subscribe",
      "delivery": "transactional",
      "scope": "hub",
      "promotion": "on_change"
    },
    {
      "name": "name",
      "dataType": "String",
      "category": "Core",
      "polling": "subscribe",
      "delivery": "transactional",
      "scope": "hub",
      "promotion": "on_change"
    },
    {
      "name": "description",
      "dataType": "String",
      "category": "Core",
      "polling": "subscribe",
      "delivery": "transactional",
      "scope": "hub",
      "promotion": "on_change"
    },
    {
      "name": "article_no",
      "dataType": "String",
      "category": "Reference",
      "description": "Article produced by this program",
      "polling": "subscribe",
      "delivery": "transactional",
      "scope": "hub",
      "promotion": "on_change"
    },
    {
      "name": "estimated_cycle_time",
      "dataType": "Float",
      "unit": "s",
      "category": "Planning",
      "polling": "subscribe",
      "delivery": "transactional",
      "scope": "hub",
      "promotion": "on_change"
    },
    {
      "name": "tool_list",
      "dataType": "String",
      "category": "Tooling",
      "description": "Comma-separated tool IDs required",
      "polling": "subscribe",
      "delivery": "transactional",
      "scope": "hub",
      "promotion": "on_change"
    }
  ],
  "relationships": [
    {
      "type": "FOR_ARTICLE",
      "target": "Article"
    }
  ],
  "kgNodeLabel": "CNCProgram",
  "kgIdProperty": "program_id"
}
