{
  "profileId": "SMProfile-EnergyMeter",
  "version": "1.4.0",
  "standard": "CESMII",
  "displayName": "Energy Meter (Energiezähler)",
  "description": "Energiezähler — electrical power monitoring via Modbus TCP (Siemens PAC, Janitza, Socomec)",
  "parentType": null,
  "attributes": [
    {
      "name": "Voltage_L1",
      "dataType": "Float",
      "unit": "V",
      "category": "Electrical",
      "description": "Phase L1 voltage",
      "polling": "subscribe",
      "delivery": "telemetry",
      "scope": "edge",
      "promotion": "raw"
    },
    {
      "name": "Voltage_L2",
      "dataType": "Float",
      "unit": "V",
      "category": "Electrical",
      "polling": "subscribe",
      "delivery": "telemetry",
      "scope": "edge",
      "promotion": "raw"
    },
    {
      "name": "Voltage_L3",
      "dataType": "Float",
      "unit": "V",
      "category": "Electrical",
      "polling": "subscribe",
      "delivery": "telemetry",
      "scope": "edge",
      "promotion": "raw"
    },
    {
      "name": "Current_L1",
      "dataType": "Float",
      "unit": "A",
      "category": "Electrical",
      "description": "Phase L1 current",
      "polling": "subscribe",
      "delivery": "telemetry",
      "scope": "edge",
      "promotion": "raw"
    },
    {
      "name": "Current_L2",
      "dataType": "Float",
      "unit": "A",
      "category": "Electrical",
      "polling": "subscribe",
      "delivery": "telemetry",
      "scope": "edge",
      "promotion": "raw"
    },
    {
      "name": "Current_L3",
      "dataType": "Float",
      "unit": "A",
      "category": "Electrical",
      "polling": "subscribe",
      "delivery": "telemetry",
      "scope": "edge",
      "promotion": "raw"
    },
    {
      "name": "Power_Active_Total",
      "dataType": "Float",
      "unit": "kW",
      "category": "Power",
      "description": "Total active power",
      "polling": "subscribe",
      "delivery": "telemetry",
      "scope": "edge",
      "promotion": "raw"
    },
    {
      "name": "Power_Reactive_Total",
      "dataType": "Float",
      "unit": "kvar",
      "category": "Power",
      "polling": "subscribe",
      "delivery": "telemetry",
      "scope": "edge",
      "promotion": "raw"
    },
    {
      "name": "Power_Apparent_Total",
      "dataType": "Float",
      "unit": "kVA",
      "category": "Power",
      "polling": "subscribe",
      "delivery": "telemetry",
      "scope": "edge",
      "promotion": "raw"
    },
    {
      "name": "Power_Factor",
      "dataType": "Float",
      "unit": "",
      "category": "Power",
      "description": "cos(phi)",
      "polling": "subscribe",
      "delivery": "telemetry",
      "scope": "edge",
      "promotion": "raw"
    },
    {
      "name": "Frequency",
      "dataType": "Float",
      "unit": "Hz",
      "category": "Power",
      "polling": "subscribe",
      "delivery": "telemetry",
      "scope": "edge",
      "promotion": "raw"
    },
    {
      "name": "Energy_Active_Total",
      "dataType": "Float",
      "unit": "kWh",
      "category": "Energy",
      "description": "Total active energy consumed",
      "polling": "subscribe",
      "delivery": "telemetry",
      "scope": "edge",
      "promotion": "raw"
    },
    {
      "name": "Energy_Reactive_Total",
      "dataType": "Float",
      "unit": "kvarh",
      "category": "Energy",
      "polling": "subscribe",
      "delivery": "telemetry",
      "scope": "edge",
      "promotion": "raw"
    },
    {
      "name": "Demand_Power_Max",
      "dataType": "Float",
      "unit": "kW",
      "category": "Demand",
      "description": "Maximum demand power",
      "polling": "subscribe",
      "delivery": "telemetry",
      "scope": "edge",
      "promotion": "raw"
    }
  ],
  "relationships": [
    {
      "type": "MONITORS",
      "target": "Machine",
      "description": "Machine being monitored"
    }
  ],
  "kgNodeLabel": "EnergyMeter",
  "kgIdProperty": "machine_id",
  "deviceClass": "Energy Meter"
}
