{
  "profileId": "SMProfile-AssemblyLine",
  "version": "2.0.0",
  "standard": "CESMII",
  "displayName": "Assembly Line (Montage Linie)",
  "description": "Montage Linie — multi-station assembly with BOM material consumption, feeder management, takt time monitoring",
  "parentType": "Machine",
  "attributes": [
    {
      "name": "Act_Status_Machine",
      "dataType": "Int32",
      "required": false,
      "delivery": "transactional",
      "scope": "hub",
      "promotion": "on_change"
    },
    {
      "name": "Act_Text_MachineMode",
      "dataType": "String",
      "required": false,
      "delivery": "transactional",
      "scope": "hub",
      "promotion": "on_change"
    },
    {
      "name": "Act_Amount_PartGood",
      "dataType": "Int32",
      "required": false,
      "delivery": "transactional",
      "scope": "hub",
      "promotion": "on_change"
    },
    {
      "name": "Act_Amount_PartScrap",
      "dataType": "Int32",
      "required": false,
      "delivery": "transactional",
      "scope": "hub",
      "promotion": "on_change"
    },
    {
      "name": "Act_Amount_PartRework",
      "dataType": "Int32",
      "required": false,
      "delivery": "transactional",
      "scope": "hub",
      "promotion": "on_change"
    },
    {
      "name": "Plan_Time_Cycle",
      "dataType": "Float",
      "required": false,
      "delivery": "telemetry",
      "scope": "edge",
      "promotion": "raw"
    },
    {
      "name": "Act_Time_Cycle",
      "dataType": "Float",
      "required": false,
      "delivery": "telemetry",
      "scope": "edge",
      "promotion": "raw"
    },
    {
      "name": "Act_Energy_Power",
      "dataType": "Float",
      "required": false,
      "delivery": "telemetry",
      "scope": "edge",
      "promotion": "raw"
    },
    {
      "name": "Act_Energy_Total",
      "dataType": "Float",
      "required": false,
      "delivery": "telemetry",
      "scope": "edge",
      "promotion": "raw"
    },
    {
      "name": "Act_Ref_ProductionOrder",
      "dataType": "String",
      "required": false,
      "delivery": "transactional",
      "scope": "hub",
      "promotion": "on_change"
    },
    {
      "name": "Act_Ref_Article",
      "dataType": "String",
      "required": false,
      "delivery": "transactional",
      "scope": "hub",
      "promotion": "on_change"
    },
    {
      "name": "Act_Ref_Tool",
      "dataType": "String",
      "required": false,
      "delivery": "transactional",
      "scope": "hub",
      "promotion": "on_change"
    },
    {
      "name": "Act_Ref_Shift",
      "dataType": "Int32",
      "required": false,
      "delivery": "transactional",
      "scope": "hub",
      "promotion": "on_change"
    },
    {
      "name": "Act_Ref_Operator",
      "dataType": "String",
      "required": false,
      "delivery": "transactional",
      "scope": "hub",
      "promotion": "on_change"
    },
    {
      "name": "Act_Status_Line",
      "dataType": "String",
      "required": false,
      "delivery": "transactional",
      "scope": "hub",
      "promotion": "on_change"
    },
    {
      "name": "Act_Speed_Conveyor",
      "dataType": "Float",
      "required": false,
      "delivery": "telemetry",
      "scope": "edge",
      "promotion": "raw"
    },
    {
      "name": "Set_Speed_Conveyor",
      "dataType": "Float",
      "required": false,
      "delivery": "telemetry",
      "scope": "edge",
      "promotion": "raw"
    },
    {
      "name": "Act_Amount_StationActive",
      "dataType": "Int32",
      "required": false,
      "delivery": "telemetry",
      "scope": "edge",
      "promotion": "raw"
    },
    {
      "name": "Act_Time_Takt",
      "dataType": "Float",
      "required": false,
      "delivery": "telemetry",
      "scope": "edge",
      "promotion": "raw"
    },
    {
      "name": "Plan_Time_Takt",
      "dataType": "Float",
      "required": false,
      "delivery": "telemetry",
      "scope": "edge",
      "promotion": "raw"
    },
    {
      "name": "Act_Amount_BufferLevel",
      "dataType": "Int32",
      "required": false,
      "delivery": "telemetry",
      "scope": "edge",
      "promotion": "raw"
    }
  ],
  "relationships": [
    {
      "type": "ASSEMBLES",
      "target": "Article",
      "description": "Finished assembly product"
    },
    {
      "type": "CONSUMES",
      "target": "Article",
      "description": "BOM components consumed during assembly"
    }
  ],
  "kgNodeLabel": "AssemblyLine",
  "kgIdProperty": "machine_id",
  "companionSpec": "OPC40001-1",
  "opcuaTypeDefinition": "AssemblyLineType",
  "deviceClass": "Assembly Line",
  "kpiRefs": [
    "KPI-Line-Efficiency"
  ]
}
