{
  "profileId": "SMProfile-Pool",
  "version": "1.4.0",
  "standard": "CESMII",
  "displayName": "Machine Pool",
  "description": "Maschinenpool — Gruppe austauschbarer Maschinen",
  "parentType": null,
  "attributes": [
    {
      "name": "name",
      "dataType": "String",
      "category": "Master",
      "polling": "subscribe",
      "delivery": "transactional",
      "scope": "hub",
      "promotion": "on_change"
    },
    {
      "name": "description",
      "dataType": "String",
      "category": "Master",
      "polling": "subscribe",
      "delivery": "transactional",
      "scope": "hub",
      "promotion": "on_change"
    }
  ],
  "relationships": [],
  "kgNodeLabel": "Pool",
  "kgIdProperty": "pool_id"
}
